{"catalogVersion":"detector-catalog-v2","classes":[{"benignLookalikes":["public-key","truncated-pem","encrypted-key"],"budgets":{"maxDecodeDepth":1,"maxInputBytes":65536,"maxMatches":16},"classId":"private-key","credential":{"exploitability":"STANDALONE","role":"PRIVATE_KEY"},"defaults":{"recommended":"BLOCK","restricted":"BLOCK","unsupported":"DEGRADED"},"evidence":{"defaultTier":"A","possibleTiers":["A","D"]},"family":"PRIVATE_KEY","hardStopEligible":{"eligibleEvidenceTiers":["A"],"rationale":"parsed-private-key"},"lifecycle":"CURRENT","limitations":["encrypted-key-degraded","no-issuer-liveness"],"owner":"DETECTOR","representations":["pem","base64-wrapped","json-string"],"securityCardId":"private-key","surfaces":["runtime-prompt","runtime-tool","local-proxy","browser-composer","browser-upload"],"transforms":["private-key.minimum-unit"],"validators":["pem-private-key-parse"]},{"benignLookalikes":["aws-doc-example","identifier-only","secret-only"],"budgets":{"maxDecodeDepth":1,"maxInputBytes":65536,"maxMatches":32},"classId":"aws-credential-pair","credential":{"exploitability":"PAIRED","role":"STANDALONE_BEARER"},"defaults":{"recommended":"BLOCK","restricted":"BLOCK","unsupported":"DEGRADED"},"evidence":{"defaultTier":"A","possibleTiers":["A","C"]},"family":"CREDENTIAL","hardStopEligible":{"eligibleEvidenceTiers":["A"],"rationale":"validated-access-secret-pair"},"lifecycle":"CURRENT","limitations":["issuer-liveness-not-checked"],"owner":"DETECTOR","representations":["plain-text","base64-wrapped","json-string"],"securityCardId":"aws-credential-pair","surfaces":["runtime-prompt","runtime-tool","local-proxy","browser-composer","browser-upload"],"transforms":["credential-pair.minimum-unit"],"validators":["aws-access-secret-pair"]},{"benignLookalikes":["redacted-service-account","truncated-json"],"budgets":{"maxDecodeDepth":0,"maxInputBytes":65536,"maxMatches":8},"classId":"gcp-service-account","credential":{"exploitability":"STANDALONE","role":"PRIVATE_KEY"},"defaults":{"recommended":"BLOCK","restricted":"BLOCK","unsupported":"DEGRADED"},"evidence":{"defaultTier":"A","possibleTiers":["A","D"]},"family":"CREDENTIAL","hardStopEligible":{"eligibleEvidenceTiers":["A"],"rationale":"parsed-service-account"},"lifecycle":"CURRENT","limitations":["no-issuer-liveness"],"owner":"DETECTOR","representations":["json-string","plain-text"],"securityCardId":"gcp-service-account","surfaces":["runtime-prompt","runtime-tool","local-proxy","browser-composer","browser-upload"],"transforms":["service-account.minimum-unit"],"validators":["gcp-service-account-json-parse"]},{"benignLookalikes":["placeholder-connection-string","topology-only-string"],"budgets":{"maxDecodeDepth":0,"maxInputBytes":65536,"maxMatches":32},"classId":"azure-connection-string","credential":{"exploitability":"PAIRED","role":"STANDALONE_BEARER"},"defaults":{"recommended":"REDACT","restricted":"BLOCK","unsupported":"DEGRADED"},"evidence":{"defaultTier":"A","possibleTiers":["A","B"]},"family":"CREDENTIAL","hardStopEligible":{"eligibleEvidenceTiers":["A"],"rationale":"parsed-credential-components"},"lifecycle":"CURRENT","limitations":["no-credential-liveness"],"owner":"DETECTOR","representations":["plain-text","json-string"],"securityCardId":"azure-connection-string","surfaces":["runtime-prompt","runtime-tool","local-proxy","browser-composer","browser-upload"],"transforms":["connection-string.minimum-unit"],"validators":["azure-connection-string-parse"]},{"benignLookalikes":["test-card","order-number"],"budgets":{"maxDecodeDepth":0,"maxInputBytes":65536,"maxMatches":64},"classId":"payment-card","credential":{"exploitability":"NOT_APPLICABLE","role":"NONCREDENTIAL_SENSITIVE"},"defaults":{"recommended":"REDACT","restricted":"BLOCK","unsupported":"DEGRADED"},"evidence":{"defaultTier":"A","possibleTiers":["A","C"]},"family":"FINANCIAL_DATA","hardStopEligible":{"eligibleEvidenceTiers":[],"rationale":"sensitive-data-requires-contextual-policy"},"lifecycle":"CURRENT","limitations":["test-card-context-not-distinguished"],"owner":"DETECTOR","representations":["plain-text","json-string"],"securityCardId":"payment-card","surfaces":["runtime-prompt","runtime-tool","local-proxy","browser-composer","browser-upload"],"transforms":["payment-card.minimum-unit"],"validators":["luhn-check"]},{"benignLookalikes":["masked-iban","example-iban"],"budgets":{"maxDecodeDepth":0,"maxInputBytes":65536,"maxMatches":64},"classId":"iban","credential":{"exploitability":"NOT_APPLICABLE","role":"NONCREDENTIAL_SENSITIVE"},"defaults":{"recommended":"REDACT","restricted":"BLOCK","unsupported":"DEGRADED"},"evidence":{"defaultTier":"A","possibleTiers":["A","C"]},"family":"FINANCIAL_DATA","hardStopEligible":{"eligibleEvidenceTiers":[],"rationale":"sensitive-data-requires-contextual-policy"},"lifecycle":"CURRENT","limitations":["account-owner-not-verified"],"owner":"DETECTOR","representations":["plain-text","json-string"],"securityCardId":"iban","surfaces":["runtime-prompt","runtime-tool","local-proxy","browser-composer","browser-upload"],"transforms":["iban.minimum-unit"],"validators":["iban-mod97"]},{"benignLookalikes":["topology-only-uri","localhost-uri","documentation-uri"],"budgets":{"maxDecodeDepth":0,"maxInputBytes":65536,"maxMatches":32},"classId":"db-connection-string","credential":{"exploitability":"CONTEXTUAL","role":"SECRET_COMPONENT"},"defaults":{"recommended":"REDACT","restricted":"BLOCK","unsupported":"DEGRADED"},"evidence":{"defaultTier":"B","possibleTiers":["A","B","C"]},"family":"DATABASE_URI","hardStopEligible":{"eligibleEvidenceTiers":[],"rationale":"credential-presence-and-sink-required"},"lifecycle":"CURRENT","limitations":["tier-a-requires-parser-and-credential-field"],"owner":"DETECTOR","representations":["plain-text","json-string","uri-encoded"],"securityCardId":"db-connection-string","surfaces":["runtime-prompt","runtime-tool","local-proxy","browser-composer","browser-upload"],"transforms":["database-uri.remove-credentials"],"validators":["database-uri-parse"]},{"benignLookalikes":["aws-doc-example","git-sha"],"budgets":{"maxDecodeDepth":1,"maxInputBytes":65536,"maxMatches":64},"classId":"aws-access-key","credential":{"exploitability":"PAIRED","role":"IDENTIFIER_COMPONENT"},"defaults":{"recommended":"REDACT","restricted":"BLOCK","unsupported":"DEGRADED"},"evidence":{"defaultTier":"B","possibleTiers":["B","C"]},"family":"CREDENTIAL","hardStopEligible":{"eligibleEvidenceTiers":[],"rationale":"identifier-shape-not-credential-proof"},"lifecycle":"CURRENT","limitations":["issuer-liveness-not-checked","tier-c-public-example"],"owner":"DETECTOR","representations":["plain-text","json-string","base64-wrapped"],"securityCardId":"aws-access-key","surfaces":["runtime-prompt","runtime-tool","local-proxy","browser-composer","browser-upload"],"transforms":["secret.mask.minimum-unit"],"validators":["aws-access-key-shape"]},{"benignLookalikes":["sha1","base64-data"],"budgets":{"maxDecodeDepth":0,"maxInputBytes":65536,"maxMatches":32},"classId":"aws-secret-key","credential":{"exploitability":"PAIRED","role":"SECRET_COMPONENT"},"defaults":{"recommended":"WARN","restricted":"BLOCK","unsupported":"DEGRADED"},"evidence":{"defaultTier":"B","possibleTiers":["B","C"]},"family":"CREDENTIAL","hardStopEligible":{"eligibleEvidenceTiers":[],"rationale":"contextual-component-not-standalone"},"lifecycle":"CURRENT","limitations":["requires-aws-context","not-standalone"],"owner":"DETECTOR","representations":["plain-text","json-string"],"securityCardId":"aws-secret-key","surfaces":["runtime-prompt","runtime-tool","local-proxy","browser-composer","browser-upload"],"transforms":["secret.mask.minimum-unit"],"validators":["aws-secret-context"]},{"benignLookalikes":["synthetic-key"],"budgets":{"maxDecodeDepth":1,"maxInputBytes":65536,"maxMatches":64},"classId":"gcp-key","credential":{"exploitability":"STANDALONE","role":"STANDALONE_BEARER"},"defaults":{"recommended":"REDACT","restricted":"BLOCK","unsupported":"DEGRADED"},"evidence":{"defaultTier":"B","possibleTiers":["B"]},"family":"CREDENTIAL","hardStopEligible":{"eligibleEvidenceTiers":[],"rationale":"shape-not-live-credential-proof"},"lifecycle":"CURRENT","limitations":["issuer-liveness-not-checked"],"owner":"DETECTOR","representations":["plain-text","json-string","base64-wrapped"],"securityCardId":"gcp-key","surfaces":["runtime-prompt","runtime-tool","local-proxy","browser-composer","browser-upload"],"transforms":["secret.mask.minimum-unit"],"validators":["gcp-api-key-shape"]},{"benignLookalikes":["md5","hex-id"],"budgets":{"maxDecodeDepth":0,"maxInputBytes":65536,"maxMatches":64},"classId":"azure-key","credential":{"exploitability":"CONTEXTUAL","role":"SECRET_COMPONENT"},"defaults":{"recommended":"WARN","restricted":"BLOCK","unsupported":"DEGRADED"},"evidence":{"defaultTier":"B","possibleTiers":["B"]},"family":"CREDENTIAL","hardStopEligible":{"eligibleEvidenceTiers":[],"rationale":"contextual-shape-not-proof"},"lifecycle":"CURRENT","limitations":["contextual-only"],"owner":"DETECTOR","representations":["plain-text","json-string"],"securityCardId":"azure-key","surfaces":["runtime-prompt","runtime-tool","local-proxy","browser-composer","browser-upload"],"transforms":["secret.mask.minimum-unit"],"validators":["azure-key-context"]},{"benignLookalikes":["placeholder-key"],"budgets":{"maxDecodeDepth":1,"maxInputBytes":65536,"maxMatches":64},"classId":"openai-key","credential":{"exploitability":"STANDALONE","role":"STANDALONE_BEARER"},"defaults":{"recommended":"REDACT","restricted":"BLOCK","unsupported":"DEGRADED"},"evidence":{"defaultTier":"B","possibleTiers":["B"]},"family":"CREDENTIAL","hardStopEligible":{"eligibleEvidenceTiers":[],"rationale":"shape-not-live-credential-proof"},"lifecycle":"CURRENT","limitations":["issuer-liveness-not-checked"],"owner":"DETECTOR","representations":["plain-text","json-string","base64-wrapped"],"securityCardId":"openai-key","surfaces":["runtime-prompt","runtime-tool","local-proxy","browser-composer","browser-upload"],"transforms":["secret.